{
  "schema": "set_op@1",
  "run_id": "run-20261022-a1",
  "op_id": "op-2",
  "op": "dedup",
  "inputs": [
    "union-1"
  ],
  "params": {
    "order": [
      "openalex",
      "doi",
      "arxiv"
    ]
  },
  "output": "candidates-1",
  "created_at": "2026-10-22T10:01:10Z",
  "stats": {
    "input_sizes": [
      4
    ],
    "output_size": 3,
    "merged": 1
  }
}
